a_line_number	b_z_score	c_source_sent	d_reference_sent	e_system_output	f_neg_error	g_notes	h_source	
2194	0.397	Dün bu yazıyı yazdığım öğleden sonra saatlerinde istifa ettiği haberi yayılmıştı ama durum henüz resmen açıklanmamıştı.	When I wrote this piece, rumors were spread about his resigning in the afternoon, but nothing was officially announced.	Yesterday I wrote this article in the afternoon of the news that he resigned, but the situation has not been officially announced yet.	0			
2421	0.399	Özbek'in icraatları: Tenkit etmek istemiyorum.	On Özbek’s activities: I don’t want to criticize.	Özbek's actions: I do not want to criticize.	0			
2749	0.403	Ölmek istemiyorum ve sana maddi olarak yardım etmek istiyorum.	I don’t want to die, I wanted to help you out financially.	I don't want to die, And I want to help you financially.	0			
444	0.406	Basın denetlemesinin olmaması, Endonezya hükümetine uluslararası baskının çoğunlukla Papua'nın hemen yakınındaki komşularıyla sınırlı olduğu anlamına geliyor.	The lack of press scrutiny means international pressure on the Indonesian government has been largely limited to Papua's immediate neighbors.	The lack of press surveillance means that the international pressure on the Indonesian government is mostly confined to its neighbors near Papua.	0			
2260	0.411	Ben ona, kaba ırkçılığı kişisel olarak deneyimlemeyeceği bir deneyim yaşatacak kadar dahi şanslı olsam, herhangi bir siyah kadın-çocuktan bir farkı olmayacak.	Even if I'm fortunate enough to provide her an experience where she doesn't personally experience blatant racism, she is no different than the next black woman-child.	If I were lucky enough to give her an experience that she wouldn't personally experience rude racism, she would be no different from any black woman-child.	0			
2210	0.417	Kendisine ordu komutanlığı teklif ediliyor ama "İsmet benden kıdemsizdir, onun emrine giremem" diyor.	He was offered the army commandership, but he said "İsmet is junior to me, I cannot go under his command".	He is offered an army command, but he says, "Ismet is seniority from me, I can't go under his command."	0			
187	0.417	Maryland Bowie'den avukat Lakshmi Sarma Ramani, nefret dolu değildi fakat nefret suçları hakkında soru sordu.	Attorney Lakshmi Sarma Ramani of Bowie, Md., wasn't hateful, but she asked about hate crimes.	Lawyer Lakshmi Sarma ramani from Bowie, Maryland, was not hateful, but asked about hate crimes.	0			
2711	0.417	Yunan otoriteleri bedava kamp yapma üzerine olan kontrollerini sıkılaştırdı ve halen o amaç için ayrılmamış yerlerde dinlenirken yakalananlara ciddi cezalar kesiyor.	The Greek authorities have tightened control over free camping and are already imposing serious fines on anyone who is caught resting in a place not intended for the purpose.	Greek authorities have tightened their control over free camping and are still paying serious penalties for those caught while resting in places that have not been reserved for that purpose.	0			
1707	0.417	Bu değişmez faktörler Kelly'nin görevini oldukça zorlaştıracak.	Those immutable factors will make Kelly's mission very difficult.	These unchanging factors will make Kelly's mission very difficult.	0			
2778	0.436	Doktora sonrası araştırmacısı Dr. Luisa Cervantes-Barraganwas, dayanıklılığı geliştiren bir çeşit bağışıklık hücresi üzerinde çalışırken, bir grup deney faresinin bu tür hücrelere sahip olduğunu fakat aynı türden olup farklı bir yerde tutulan diğer bir grubun buna sahip olmadığını keşfetti.	Postdoctoral researcher Dr Luisa Cervantes-Barraganwas studying a kind of immune cell that promotes tolerance when she discovered that one group of study mice had such cells but another group of the same strain but housed separately did not.	Postdoctoral Researcher Dr. While Luisa Cervantes-Barraganwas working on a type of immune cell that improves endurance, she discovered that a group of rats had these cells, but that another group of rats who were the same type and kept in a different place did not.	0			
97	0.44	Air France'den yapılan açıklamada ise füzenin uçağın rotasıyla kesişmediği ve söz konusu uçuşta bir sorun yaşanmadığı kaydedildi.	In a statement made by Air France, he airline said that the missile’s route did not intersect with the airliner’s path and no issue had been recorded in relation to the mentioned flight.	Air France said that the missile had not crossed the course of the plane and that there was no problem with the flight.	0			
2860	0.445	"Ve biliyorum ki Sikorsky ve Connecticut eyaleti ulusal güvenliğimize yaptıkları katkılardan çok gurur duyuyorlar ve zannediyorum ki binler olmasa bile yüzlerce kişinin işi buna bağlı.	"And I know Sikorsky and the state of Connecticut are very proud of the fact that they contribute to our national security, that there are, I assume, hundreds if not thousands of people whose job depends on that.	"And I know Sikorsky and the state of Connecticut are very proud of their contribution to our national security, and I think it depends on the job of hundreds of people without thousands.	1			
2555	0.447	Bu sayıda elimize ulaşan bir istifa söz konusu olmadığı gibi bahsi geçen yerlerdeki müstafilerin sayısı bir elin parmaklarını geçmemektedir.	There are no such numbers of resignations and, besides, the number of those who have resigned in the said places can be counted on the fingers of one hand.	There is no such thing as a resignation that reaches us, nor does the number of staffs in the mentioned places surpass the fingers of a hand.	1			
1339	0.447	Bu yıl trafiğin yine diğer branşlardaki karları götüreceğini söyleyen Çağlar, "Bu tavan fiyatlarla bu zarar sürdürülemez.	Noting that this year the traffic arm would take off the profits of the industry’s other arms, Çağlar said "With these capped prices, this loss is not sustainable.	This year the traffic will take the profits again in other branches said Caglar, "this damage can not be sustained at the prices of ceiling.	0			
1911	0.447	Biz de dedik ki bu böyle olmaz.	And we said that it could not happen like that.	We said that's not how it works.	0			
2170	0.449	Tamamen ücretsiz olan hizmet için herhangi bir sağlık güvencesi zorunluluğu da bulunmuyor.	There is no pre-requirement for any health insurance for this completely free service.	There is no need for any health insurance for the service which is completely free.	0			
1078	0.449	18 yaşından büyük olduğuna hükmedilen vakaların oranının yüksekliği mültecilerin yaşları hakkında mutlaka yalan söylediği anlamına gelmiyor.	The high proportion of cases judged to be over 18 does not necessarily mean that the asylum seeker lied about their age.	The proportion of cases judged to be over 18 does not necessarily mean that refugees are lying about their age.	0			
2417	0.45	Ama oyuncu kim olursa olsun, başkan onun ayağına gitmez.	But, whoever is the player, the president does not go to him.	But no matter who the player is, the President won't go to his feet.	0			
2605	0.457	Skor 1-1 olduktan sonra iki net fırsattan yararlanamadılar.	After getting to a score of 1-1, they could not then benefit from two clear opportunities.	After the score was 1-1, they could not take advantage of two clear opportunities.	0			
1005	0.457	"Yaşananların ardından doğalgaz ihracatımızda bir düşüş değil aksine yüzde 30'luk bir artış yaşadık" dedi.	"After what happened, we had an increase of 30% in our exports, not a decrease" he said.	"Following the events, we experienced a 30 percent increase in our natural gas exports, not a decrease," he said.	0			
2470	0.457	Fakat veriler, şirketin sorumluları harekete geçmezse işe yaramaz oluyor.	But the data are useless unless a company's custodians take action.	But the data is useless if the company's responsible don't take action.	0			
1354	0.463	Bakanlık, tıbbi öz bakımlarını gideremedikleri, yatağa bağımlı olarak yaşamlarını sürdürdükleri veya ev yaşam koşullarının iyileştirilmesi gerekliliği ilgili sağlık birimince tespit edilen tüberküloz hastalarına ek ödeme de yapacak.	The Ministry will make additional payments to those tuberculosis patients who have been identified by the health unit as being unable to fulfil their medical self-care, who are bedridden, or who need improvements in their houses’ living conditions.	The Ministry will also pay extra for tuberculosis patients whose medical self-care cannot be removed, who are dependent on bed or who are determined by the relevant health unit to improve the conditions of home life.	0			
55	0.466	Sanders bu yılın başında, eyaletten geçerken yakıtının bitmesi ardından Missouri polisi tarafından bir suçla suçlanmadan göz altına alınmış ve şüpheli şartlarlar altında ölmüştü.	Sanders died under questionable circumstances earlier this year after he ran out of gas while traveling through the state, and was taken into custody by Missouri police without being accused of a crime.	Sanders was arrested earlier this year for a charge by the Missouri police after he ran out of fuel as he passed through the state and died under suspicious circumstances.	1			
2448	0.466	Quinlan şöyle dedi: Eğer bir şirket, çalışanlarına kötü davranıyor ya da etik davranmıyorsa, düzenleyiciler devreye girmese bile tüketici boykotları, çalışan zaiyatı ya da davalar nedeniyle masraflı sonuçlarla karşı karşıya kalabilir.	If a company is found to treat its employees poorly or behave unethically, even if regulators don't step in, it can face costly consequences from consumer boycotts, employee attrition and lawsuits, Quinlan said.	Quinlan said: If a company is not treating its employees badly or ethically, it may face costly consequences because of consumer boycotts, employee weakness, or lawsuits, even if regulators don't come into play.	0			
2245	0.467	Ferrell "'Bu alışılmış değil.'" dediğini hatırladı.	"'This is not usual,'" Ferrell recalled saying.	"This is unusual.he remembered what he said.	1			
26	0.475	Asteroidin vereceği zarar sadece asteroidin kimyasal bileşimine değil çarpacağı bölgenin kayaç yapısına da bağlı.	The damage caused by an asteroid depends not only on the asteroid’s chemical compound, but also on the rock formations at the point of impact.	The damage to the asteroid is not only due to the chemical composition of the asteroid, but also to the rocky structure of the region it is going to hit.	0			
2402	0.48	Kimse raporu şartsız olarak kabul etmeyi düşünmüyor." diye ekledi, Smirnov.	No one plans to accept this report unconditionally," Smirnov added.	No one wants to accept the report unconditionally."he added, Smirnov.	0			
257	0.493	Bu cümlenin kodu şudur: Sünniliğe sahip çıkmadı!	The decoding of this sentence is this: He did not look out for the Sunnis!	The Code of this sentence is this: he did not have circumcision!	1			
495	0.493	Sıvılara yurt içi uçuşlarda izin veriliyor fakat uluslararası olanlarda izin verilmiyor.	Liquids are allowed on domestic flights, but not on international ones.	Liquids are allowed on domestic flights, but international ones are not allowed.	0			
747	0.493	Marbaugh şöyle dedi: "Kirlenmiş hissediyorum çünkü bu ben değilim."	"I feel dirty because this is not who I am," said Marbaugh.	Marbaugh said: "I feel dirty because it's not me."	0			
181	0.494	The Washington Post ile olan bir röportajda Hogan'ın kadın sözcüsü Amelia Chasse, yorumları engellemenin onları düzenlemekten fazlası olmadığını iddia ederek valinin icraatlarını savundu.	In an interview with The Washington Post, Hogan spokeswoman Amelia Chasse defended the governor's actions, arguing that blocking the comments was nothing more than moderating them.	In an interview with the Washington Post, Hogan's female spokeswoman, Amelia Chasse, defended the Governor's actions, claiming that blocking Comments Was more than just editing them.	1	contradiction		
2428	0.494	Amy Errett e-ticaret start-up'ındaki çalışan mutluluğunu ölçmek istedi fakat anketler işe yaramıyordu.	Amy Errett wanted to gauge employee happiness at her e-commerce start-up, but surveys weren't working.	Amy errett wanted to measure her employee's happiness in e-commerce start-up, but the Polls didn't work.	0			
1997	0.495	Şiddette paydos yok, ülke çapında ceset sayısı artarken, bunlardan daha da fazlası gazeteciler oluyor: Gazetecileri Koruma Komitesi'ne göre, Başkan Enrique Pena Nieto Aralık 2012'de görevi devraldığından beri en az 25 kişi; saldırı ve tehditlerden sonra 589'u federal koruma altında ve bu yıl şu ana kadar yedi eyalette en az yedisi öldü.	There is no respite from the violence, and as bodies pile up across the country, more and more of them are journalists: at least 25 since President Enrique Pena Nieto took office in December 2012, according to the Committee to Protect Journalists; 589 under federal protection after attacks and threats; and so far this year, at least seven dead in seven states.	According to the journalists Protection Committee, at least 25 people since President Enrique Pena Nieto took office in December 2012; 589 have been under federal Protection and at least seven have been killed in seven States this year after attacks and threats.	1			
2553	0.495	250 istifa, 300 istifa gibi asılsız mesnetsiz haberlerle kamuoyu yanlış yönlendirilmektedir.	The public is confused by baseless, unfounded news items such as claims of 250 resignations, 300 resignations.	The public is misled by unfounded news such as 250 resignation, 300 resignation.	0			
2604	0.497	Ya takım genç oyuncuya güvenmedi ya da performansının biraz daha gelişmesi gerekiyor.	Either the team did not trust the young player, or his performance needs to develop more.	Either the team did not trust the young player or the performance needs to improve a little more.	0			
2737	0.497	Gençlerin ailelerinin büyük birer acı yaşamakta olduğunu dile getiren avukat, gazetecilerden bu konuda açıklama almak için ısrarcı olmamalarını da istedi.	Relating how the young people’s families are undergoing a time of great sorrow, the lawyer told journalists to not insist on obtaining statements from them.	The lawyer also asked journalists not to insist on getting an explanation on this subject.	0			
2099	0.498	Eğer korkuyorlarsa bile göstermiyorlardı.	If they were at all afraid, they didn't show it.	If they were afraid, they wouldn't show it.	0			
247	0.514	Demek Erdoğan ile sorunu yoktu.	So, he had no problem with Erdoğan.	So he didn't have a problem with erdoğan.	0			
2222	0.525	Kendisine ordu komutanlığı teklif edildiğinde aynı şeyleri Ali İhsan Paşa da söylüyor: "Benden kıdemsiz olan İsmet'in emrinde savaşamam"...	When he was offered the army’s commandership, the same things were also uttered by Ali İhsan Paşa: "İsmet is junior to me, and I cannot fight under his command"...	Ali Ihsan paşa says the same thing when he is offered army command: "I cannot fight under Ismet, who is without seniority"...	0			
1083	0.525	"Bunun hakkında düşünmek için nedenlerim var ve kullanılan tür ölçümlemenin bu olmaması gerektiğini düşünüyorum.	"I've had reason to think about this, and I don't think the type of measurement being used should be.	"I have reasons to think about it, and I don't think this should be the kind of measurement used.	0			
2743	0.527	Biraz duman var, ama endişelenme, kurtarılmayı bekliyoruz.	There’s a little smoke, but don’t worry, we’re waiting to be rescued.	There's some smoke, but don't worry, we're waiting to be rescued.	0			
456	0.53	Adaletin hiçbir zaman yerine getirilemeyebileceğini bilerek en azından sorumlu olanların suçlarını unutmamasını sağlayacaklar.	Knowing that justice may never be served, at least they won't let those responsible forget their crimes.	They will make sure that at least those responsible do not forget their crimes, knowing that justice can never be done.	0	error in modals		
68	0.533	Çin'de yabancı statüsünde bulunması nedeniyle listeye yazılmayan Demba Ba, Siyah- Beyazlılar'a geri dönmek istediğini yönetime iletti.	Having foreign player status in China, Demba Ba could not be included in the list and so relayed to Beşiktaş his request to return.	Demba Ba, who was not listed because of his foreign status in China, told the administration that he wanted to return to the Black and whites.	0			
2500	0.543	"Bu gerçek bir endişe ve birilerinin bir oda kiralayıp orada oturup bir antrenmanı videoya çekeceğini düşünmek çok da uçuk değil.	"That is a real concern and it's not far-fetched to think that people can rent a room and sit up there and videotape a practice.	"It's a real concern, and it's not too cold to think that someone will rent a room and sit there and videotape a workout.	0			
399	0.543	5 Haziran'da TIME'a konuşan Wiranto, Papua'da bir şikayet mekanizması kurma planının olmadığını söyleyerek geri adım attı.	Then Wiranto backtracked when speaking to TIME in Jakarta on June 5, saying he has no plans to establish a grievance mechanism in Papua.	Speaking to time on June 5, Wiranto stepped back saying he had no plans to set up a complaint mechanism in Papua.	0			
493	0.546	Yani TSA tarafından el koyulan en büyük miktardaki maddenin yasaklı sıvılar olarak ortaya çıkması sürpriz değil.	So it's no surprise that the largest amount of stuff seized by the TSA happens to be forbidden liquids.	So it is no surprise that the largest amount of substances seized by the TSA came into being as prohibited liquids.	0			
2042	0.547	"Eğer onların kadınlarıyla, çocuklarıyla, temiz işleriyle, uyuşturucu nakletmek için kullandıkları gizli uçak pistleriyle uğraşırsanız bu hoşlarına gitmiyor."	"They don't like it if you mess with their women, their children, their clean businesses, their clandestine airstrips" used to move drugs.	"They don't like it if you deal with their women, their children, their clean jobs, their secret aircrafts they use to transport drugs."	0			
1356	0.549	Coğrafi koşullar, hastalık, engellilik gibi nedenlerle para çekmeye gidemeyenlere kapıda ödeme yapılacak.	For those who cannot go out to withdraw money because of geographic conditions, specific illnesses or disability, payments will be delivered to their door.	Those who are unable to withdraw money due to geographical conditions, disease and disability will be paid at the door.	0			
1885	0.551	Diğer alanda bir başarısızlık değil, başarı var.	In other fields, there is success, not failure.	There is success in the other field, not failure.	0			
1834	0.553	Sorumluluğu kabul etmedi." dedi.	She has not accepted responsibility," she said.	He didn't take responsibility." quoth.	0			
578	0.553	27 Ocak'ta Meksika başkanı Enrique Pena Nieto ile olan bir telefon görüşmesinde Trump, teklif edilen sınır duvarı için ödeme yapmayacağını halka açık olarak söylememesi konusunda onu sıkıştırdı.	On 27th January in a phone call to Mexican president, Enrique Pena Nieto, Trump urged him to stop publicly saying he would not pay for a proposed border wall.	In a telephone conversation with Mexican President Enrique Pena Nieto on January 27, Trump pressed him not to publicly say that he would not pay for the proposed border wall.	0			
81	0.553	Bunun da altını çizmem lazım; referandum bizim için bir amaç değil ancak daha büyük hedefe ulaşmamız için bir araçtır.	We have to stress this as well: The referendum is not an end in itself, but rather a means to reach to a larger goal.	I have to underline this: the referendum is not a goal for us, but a means to achieve a greater goal.	0			
2016	0.554	Sinaloa'da sokakta her gün birinin ya da birçok kişinin vurulup öldürülmesini ya da mezarlığın uyuşturucu krallarının süslü, iki katlı, yaşamak için olan birçok evden daha büyük mozoleleriyle dolu olmasını boş verin.	Never mind that someone or several people are shot dead in the street every day in Sinaloa, or that the cemetery is filled with ornate, two-story mausoleums for drug kings, larger than many homes for the living.	Never mind that every day on the street in Sinaloa, one or many people are shot and killed, or that the cemetery is filled with more mausoleums than many fancy, two-story houses to live with.	0			
1632	0.567	"Evde, duvardaki elektrik hatlarına aşık olmazsınız.	"You don't fall in love with the electrical feeds in the walls.	"At home, you don't fall in love with the power lines on the wall.	0			
742	0.571	Şöyle dedi: "Linç hakkında konuşmak istemiyoruz çünkü tümümüzü içlerimizdeki çirkinlikle yüzleştiriyor bu."	"We don't want to talk about the lynching because it makes us face the ugliness in all of us," she said.	He said, "We don't want to talk about lynching because it's confronting all of us with the ugly inside of us."	0			
2022	0.571	İkinci hata, aynı hikayenin yer aldığı başka bir gazeteye el konulmasından sonra Valdez'i, kendi güvenliği için ülkeyi terk etmeye zorlamamak oldu.	The second mistake was not forcing Valdez to leave the country for his own safety after the seizure of another newspaper that carried the same story.	The second mistake was not to force Valdez to leave the country for his own safety after the confiscation of another newspaper with the same story.	0			
2300	0.572	NBC Sports'a konuşan Irving, "Dünya yuvarlak değil."	Talking to NBC Sports, Irving said "The world is not round."	Speaking to NBC sports, Irving, "the world is not round."	0			
1776	0.598	Aşırı kilo, hareketsiz yaşam, uzun süreli oturarak iş yapma, yoğun saç ve vücut kılı ile hijyen kurallarına uymamanın kıl dönmesine sebep olduğunu belirten Dr. Mert Atak, hastalığın belirtileri arasında kuyruk sokumunda ağrı, enfeksiyon, apse ve şişlik gibi rahatsızlıkların bulunduğunu belitti.	While noting that being overweight, having a sedentary lifestyle, working seated for long periods of time, having dense hair and body hair, and not following the basic rules of hygiene each lead to pilonidal sinus, Dr. Mert Atak said the symptoms of the disease include sacral pain, infection, abscesses and swelling.	Excessive weight, still life, long-term sitting to do business, intense hair and body hair and hygiene rules with the cause of hair dönmeyeceğinin stating that the hair dönmemek. Mert attack, symptoms of the disease between the tail socket pain, infection, abscess and swelling such as belitti there are diseases.	1			
2643	0.612	Gilead Cumhuriyeti ani bir değişim fakat şu anda pek de öyle büyük bir değişimmiş gibi hissettirmiyor.	The Republic of Gilead is a leap, but, right now, it doesn't feel like a large one.	The Republic of Gilead is a sudden change, but it doesn't feel like it's a big change right now.	0			
256	0.622	İktidara yakın kaynak dedi ki: - "Geleneksel ulemaya göre, Mehmet Dönmez ehli sünnete sahip çıkmadı!"	A source close to the government said: - "According to scholars, Mehmet Görmez did not look out for orthodox followers of the sunnah!"	- According to the traditional ulama, Mehmet Dönmez did not have the people of the Sunnah!"	1			
1084	0.631	Biyolojik yaşa bu şekilde karar vermek çok şüpheli.	Judging biological age in this way is very uncertain.	It's very doubtful to decide on the biological age this way.	0			
199	0.631	Bu kadar zor olmamalı.	This shouldn't be so hard.	It shouldn't be that hard.	0			
1172	0.631	Küba'daki antrenörüm bana inanmıyordu.	My coach in Cuba did not believe me.	My coach in Cuba didn't believe me.	0			
1258	0.634	Suudi Arabistan özelinde de, iki ülke negatif açıklama yapmama konusunda dikkat ediyor.	In particular with regards to Saudi Arabia, both countries are paying special attention to not make any negative public statements.	In Saudi Arabia, the two countries are paying attention not to make any negative statements.	0			
36	0.639	Çalışmalar gösteriyor ki önümüzdeki 300-400 yıl boyunca çok ciddi yıkımlara neden olacak derecede dev bir asteroidin Dünya'ya çarpması beklenmiyor.	According to studies, no asteroid large enough to cause serious destruction is expected to collide with the Earth in the next 300–400 years.	Studies show that for the next 300-400 years, a giant asteroid is not expected to hit Earth, causing serious devastation.	0	interesting how the change in form shifts the interpretation		
1230	0.646	Sadece Türkiye'ye yatırımlar anlamında değil, bundan dolayı bazı gecikmeler yaşıyor olabiliriz.	This is not only about investments in Turkey, but because of this we could be experiencing some delays.	Not only in terms of investments in Turkey, we may be experiencing delays due to this.	0			
2770	0.652	Baş araştırmacı Dr. Marco Colonna, bağışıklık hücrelerinin yemekte saklanan mikropların vücuda gizlice girmemesi için bağırsaklarda devriye gezdiğini ifade etti.	Lead investigator Dr Marco Colonna explained immune cells patrol the gut to ensure that harmful microbes hidden in the food don't sneak into the body.	Chief of staff, prof. Marco Colonna said that the immune cells are patrolling the intestines so that the germs that are stored in the food do not enter the body.	0			
