a_line_number	b_z_score	c_source_sent	d_reference_sent	e_system_output	f_neg_error	g_notes	h_source_cue
869	0.239	Den Spagat zwischen einer barrierefreien und gleichzeitig feuersicheren Bauweise sei nicht immer einfach gewesen.	The balance between a barrier-free and fireproof design has not always been easy.	The balancing act between a barrier-free and at the same time fire-proof construction has not always been easy.	0		nicht-ADJ
962	0.241	Wer sich deshalb lieber ein Bier oder eine Bratwurst holen wollte, konnte dies unbesorgt tun.	Anyone who wanted to go get a beer or bratwurst could do it without worrying they would miss anything.	Those who therefore preferred to get a beer or a sausage, could do so without worry.	0		un-
1589	0.28	Zuvor hatten sie ihre Lebenspartnerschaft seit 2001 eintragen lassen können, es gab aber keine Gleichstellung mit der Ehe, etwa beim Adoptionsrecht.	Previously, they had been able to register their civil partnership since 2001, but there was no equality of status with marriage, for example concerning adoption laws.	Previously, they had been able to register their civil partnership since 2001, but there was no equality with marriage, such as the right to adopt.	0		kein
963	0.292	Es bestand nicht die Gefahr, eine Torchance zu verpassen, denn es gab praktisch keine.	There was no risk of missing a goal opportunity, because there were virtually none.	There was no danger of missing a scoring chance because there were virtually none.	0		nicht-V, kein
1354	0.311	Beobachter gehen davon aus, dass Bolsonaro aus dieser nicht erfolgreich hervorgehen wird - egal, gegen wen er antritt.	Experts assume that Bolsonaro will not be victorious - no matter who he is up against.	Observers assume that Bolsonaro will not emerge successfully from it - no matter who he runs against.	0		nicht-ADJ
1108	0.311	Der vom ehemaligen Bayer-Coach Carlo Ancelotti trainierte Tabellenzweite war gegen Turin zwar nicht chancenlos.	The second team in the table, coached by the former Bayer coach Carlo Ancelotti, was not without chances against Turin.	The second-placed side, coached by former Bayer coach Carlo Ancelotti, were not without a chance against Torino.	0		nicht-ADJ, -los
1717	0.314	Schweiz startet elektronisches Register für Organspender	Switzerland is starting an electronic register for organ donors	Switzerland launches electronic register for organ donors	0	no negation ???	n/a
1724	0.314	Das neue Verfahren ändert nichts daran, dass Organe weiterhin - wie in Deutschland - nur mit ausdrücklicher Zustimmung entnommen werden dürfen, betont Swisstransplant.	Swisstransplant emphasizes that the new process will not change the way organs are only extracted with express consent, as is the case in Germany.	The new procedure does not change the fact that organs may continue to be removed - as in Germany - only with explicit consent, stresses Swisstransplant.	0		nicht-V
619	0.318	Es gibt kein fixes Datum, wann wir das machen.	There is no fixed date when we will do so.	There's no fixed date when we're going to do that.	0		kein
685	0.341	Einzig RWE und Heidelberg Cement hätten signalisiert, weiterhin keine Selbstverpflichtung einzugehen, den Anteil von bislang "null Prozent" zu steigern.	Only RWE and Heidelberg Cement showed no commitment to increase the “zero percent” to date.	Only RWE and Heidelberg Cement had signalled that they would not continue to make a voluntary commitment to increase the share from "zero percent" to date.	0	ref and system use different forms	kein
1522	0.341	"Ich kann seinen Schritt nachvollziehen - da haben sich Leute geäußert, die gar nicht genau wussten, warum die Essener Tafel das macht".	I can understand his step - many people spoke up who did not even know exactly why the Essen Tafel does that.	"I can understand his move - there were people who didn't know exactly why the Essen Tafel was doing this."	0		nicht-V
1208	0.342	Eine geschlossene Tür ohne Partnerin dagegen bringe keinen Nutzen.	But that a closed door without a partner, on the other hand, offers no benefit.	A closed door without a partner, on the other hand, is of no use.	0		ohne, kein
1213	0.342	Doch die Vorsitzende Heidemarie Markenbeck ließ sich einen zusätzlichen Dank nicht nehmen.	But chairwoman Heidemarie Markenbeck refused to part without offering additional thanks.	But chairwoman Heidemarie Markenbeck did not let herself be deprived of an additional thanks.	0	ref and system use different forms	nicht-V
615	0.342	Für ihn persönlich ist das keine einfache Situation.	This is not an easy situation for him personally.	For him personally, this is not an easy situation.	0		kein
211	0.343	Dabei geht es nicht nur häufig laut zu, bei den Gelagen wird auch zerstört: Pfosten aus der Erde gerissen, Mülleimer demoliert, Schilder umgeknickt, Sitzmöbel beschmiert.	It is not just about the noise, there are also disturbances due to parties: Posts pulled out of the ground, garbage cans wrecked, signs snapped and seating daubed.	Not only is it often loud, the banquets also destroy: posts are torn out of the ground, rubbish bins are demolished, signs are bent over, seating furniture is smeared.	0	ref and system use different forms	nicht nur
289	0.353	Das regte niemanden auf.	This did not bother anybody.	No one was upset by that.	0	ref and system use different forms	niemand
6	0.353	Hvar - Flirten, kokettieren, verführen - keine einfachen Aufgaben für unsere Mädchen.	Hvar with its flirting, coquetting, and seduction is not an easy task for our girls.	Hvar - flirting, flirting, seducing - no easy tasks for our girls.	0	ref and system use different forms	kein
492	0.354	Schnell führten die Hausherren mit 8:1, auch die frühe Auszeit, die Bieletzki genommen hatte, fruchtete zunächst nicht.	Quickly, the home team led with 8-1, also the early break, that Bieletzki had taken, did not pan out.	The hosts quickly led 8-1, and even the early break Bieletzki had taken did not bear fruit at first.	0		nicht-V
873	0.366	Und weiter: "Das Grundstück in dieser Lage ist ein echter Glücksfall, weil es so in der heutigen Situation nicht mehr zu erwerben ist".	And also: ‘The property in this location is a real stroke of luck, because it no longer needs to be acquired in today’s situation’.	And further: "The property in this situation is a real stroke of luck, because it can no longer be acquired in this way in the current situation."	0	slightly off	nicht mehr
1727	0.367	In über 60 Prozent der Gespräche kennen die Angehörigen den Wunsch des Verstorbenen nicht.	In over 60 percent of conversations, relatives do not know the dead person’s intentions.	In more than 60 per cent of conversations, relatives do not know the wishes of the deceased.	0		nicht-V
1523	0.376	Sartor sei aber immer noch aktiv für die Essener Tafel - "sechs Tage die Woche, da ändert sich nichts dran", so Weilerswist.	But Sartor is still working for the Essener Tafel - “six days a week, nothing has changed about it,” says Weilerswist.	Sartor, however, is still active for the Essen Tafel - "six days a week, nothing changes," says Weilerswist.	0		nichts
604	0.379	Seit Beginn des neuen Schuljahres beteiligt sich die Ludgerischule an der Aktion "Deckel gegen Polio - 500 Deckel für ein Leben ohne Kinderlähmung".	Since the start of the new school year the Ludgerischule has been involved in the action ‘Caps against Polio - 500 caps for a life without polio’.	Since the beginning of the new school year, the Ludgeri School has been participating in the campaign "Caps against Polio - 500 Caps for a Life Without Polio."	0		ohne
603	0.379	Billerbeck: 500 Deckel für ein Leben ohne Lähmung	Billerbeck: 500 caps for a life without polio	Billerbeck: 500 lids for a life without paralysis	0		ohne
1548	0.382	In Wolfsburg erlebte Michael Lang kein vollends geglücktes, aber auch kein misslungenes Debüt für Borussia Mönchengladbach.	Michael Lang playing in Wolfsburg, did not experience a completely successful, but neither a failed debut for Borussia Mönchengladbach.	In Wolfsburg, Michael Lang did not experience a completely successful, but also not a failed debut for Borussia Mönchengladbach.	0		kein
613	0.383	Und das tut uns nicht gut", sagte der mit Götze befreundete Reus nach dem 4:2-Sieg in Leverkusen beim TV-Sender Sky.	And it also does not do us any good, said Reuss, Götze’s friend, after the 4-2 victory in Leverkusen in an interview with the TV channel Sky.	And that is not good for us, "Reus, who is a friend of Götze, told the TV channel Sky after the 4-2 win in Leverkusen.	0		nicht-ADV
1811	0.386	Im Moment haben wir Handyempfang, vorher hat das allerdings nicht funktioniert und wir haben Informationen nur übers Radio bekommen.	At the moment we have mobile reception, which did not work previously and we have been receiving information via radio.	At the moment we have mobile phone reception, but before that it did not work and we only got information over the radio.	0		nicht-V
1250	0.389	Wir konnten den Aufschlagdruck nicht halten.	We could not hold the pressure.	We couldn't hold the serve pressure.	0		nicht-V
304	0.4	Heidrich: "Es ist bedauerlich, dass man nicht eine bessere Nutzung des Standortes, auch in puncto Güterverkehr, ins Auge gefasst hat".	Heidrich: ‘It’s a shame that better use of the location is not envisaged, also with regard to freight traffic’.	Heidrich: "It is regrettable that a better use of the site has not been envisaged, including in terms of freight transport."	0		nicht-V
800	0.401	Noch konnten sich wohl nicht viele der Kinder vorstellen, wie daraus einmal ein schmackhaftes Getränk werden sollte.	Not many of the children could imagine how a tasty drink was to be made from it.	Not many of the children could yet imagine how it would one day become a tasty drink.	0		nicht viele
552	0.41	Leroy Sané bereitete das 1:0 vor, Ilkay Gündogan kam beim neuen Spitzenreiter nicht zum Einsatz.	Leroy Sané prepared the 1:0, Ilkay Gündogan as a new attacking player was not used.	Leroy Sané made it 1-0 and Ilkay Gündogan did not feature for the new leaders.	0	ref and system use different forms	nicht-PP
476	0.411	Da dürfte sein Hauptdarsteller nicht weit sein.	Its main character will not be far away.	His lead actor is unlikely to be far behind.	0	ref and system use different forms	nicht-ADV
454	0.411	Unser Falter ist keine Motte, aber doch ein wenig lichtscheu.	Not really a moth, just a little shady.	Our moth is not a moth, but it is a little shy of light.	0	ref and system use different forms	kein
1525	0.411	Man dürfe nicht den Ansatz verfolgen, "ohne uns verhungern die Menschen in der Stadt".	One should not think, "that without us, people in the city would be starving."	One should not take the approach that "without us, the people in the city are starving."	0		nicht-V
982	0.413	Ich hatte jedenfalls nicht das Gefühl, dass wir ein Gegentor kriegen könnten", so Daut.	At any rate, I did not feel that we could concede a goal," said Daut.	In any case, I didn't feel we could get a goal against them, "Daut said.	1	contradiction, but error is in reference translation!	nicht-V
980	0.413	"Wir waren diesmal nicht so torgefährlich wie noch gegen Holzwickede und das obwohl unser Gegner keine Lust hatte, hier mitzuspielen", konstatierte RW Ahlens Interimstrainer.	We were not as dangerous against goal in this match as against Holzwickede, even though our opponents did not want to play here, states RW Ahlen’s interim coach.	"We were not as dangerous this time as we were against Holzwickede, even though our opponent had no desire to play here," stated RW Ahlen's interim coach.	0	ref and system use different forms	nicht-ADJ, kein
1675	0.415	Der 75-Jährige machte einen wirren Eindruck und konnte sich an vieles nicht mehr entsinnen.	The 75-year-old made a confusing impression and could not recall much.	The 75-year-old made a confused impression and could not remember many things.	0		nicht mehr
523	0.419	Zusätzlich sollten Sicherheitsupdates, etwa für Windows, zügig installiert werden, auch schadet es nicht, Rechner mit einem Antivirenschutz auszurüsten.	In addition, security updates, such as those for Windows, should be quickly installed and there is no harm in equipping computers with anti-virus protection.	In addition, security updates, for example for Windows, should be installed quickly, and it does no harm to equip computers with anti-virus protection.	0		nicht-V
1731	0.42	"Ein Register, in dem Menschen ihre Wünsche - pro oder kontra Organspende - eintragen können, gibt es nicht", sagt sie.	There is no register where people can record their wishes, for or against organ donation, she says.	"There is no register where people can register their wishes - for or against organ donation," she says.	0		nicht-V
1207	0.425	Da hatte Teubner ein Paradoxon ins Spiel gebracht: Die Zufriedenheit beim Manne komme, wenn er zwar eine Partnerin habe, diese aber die Tür nicht aufmache.	Teubner had introduced a paradox: She mused that a man is happy when he has a partner but does not hold the door open for her.	Teubner had brought a paradox into play: the satisfaction in a man comes when he has a partner, but she does not open the door.	1	contradiction, mostly to do with pronouns	nicht-V
983	0.434	Zu seinem Leidwesen hatte man als Zuschauer allerdings auch nicht das Gefühl, als könnte sein Team ein Tor schießen.	To his chagrin, however, the viewer did not feel like his team could score a goal, either.	Unfortunately for him, as a spectator, you did not feel as if his team could score a goal.	0		nicht-V
811	0.435	Dann allerdings, so betonte Gregor Krützkamp, wird nicht das Heimathaus im Herzen des Spargeldorfs der Ort des Geschehens sein.	Then, however, emphasized Gregor Krützkamp, the community center in the heart of the asparagus village will not be the site of the action.	In that case, however, Gregor Krützkamp stressed, the home in the heart of the asparagus village will not be the place of action.	0		nicht-V
473	0.447	Den Preis für den besten Drink erhält dieser Mix, mit dem ein Kapselhersteller sich präsentiert, nicht zwingend.	The mixture getting the prize for the best drink, presented by a capsule manufacturer - not compulsory.	This mix, with which a capsule manufacturer presents itself, does not necessarily win the prize for the best drink.	0	I think they have the same meaning ??	nicht-ADV
1297	0.448	Doch damit ist das Spektrum bei weitem nicht erschöpft.	But by far that is not the end of the scope.	But that is far from the end of the spectrum.	0	ref and system use different forms	lexical
1310	0.448	Deshalb gebe es für die Gartenbauvereine den Ansporn, nicht nachzulassen, damit unsere Heimat schön und lebenswert bleibe.	There is an incentive therefore for the gardening associations not to give up, so that our country remains beautiful and worth living.	That is why there is an incentive for the horticultural associations not to let up, so that our home remains beautiful and worth living in.	0		nicht-V
189	0.451	Regel zwei: trinkt nie die schwarze Sau.	Rule two: Never drink "die schwarze Sau".	Rule two: never drink the black sow.	0		nie
1145	0.453	"Da weiß ich gar nicht, was ich davon halten soll", rang er nach Worten.	I do not know what to think of that, he struggled for words.	"I don't know what to make of it," he said.	0		nicht-V
1190	0.463	"Die Rente ist eben nicht sicher!" steht in einem Tagungstitel.	The pension is not even safe! says a conference title.	"The pension is just not safe!" reads a conference title.	0		nicht-ADJ
1192	0.463	"Und zu einer Tagung über Syrien: "Barbarei ohne Limit".	And a conference about Syria: Barbarism without limit’.	"And to a meeting on Syria:" Barbarism without limit. "	0		ohne
1199	0.463	"Wir sind ja zu 100 Prozent eine Tochter der Evangelischen Landeskirche", sagte Studienleiterin Dr. Ulrike Haerendel, "also sind wir nicht zu 100 Prozent neutral".	We are 100 percent a subsidiary of the evangelical national church, said Director of Studies, Dr. Ulrike Haerendel, ‘but we are not 100 percent neutral’.	"We are 100 percent a subsidiary of the Evangelical Church," said study leader Dr. Ulrike Haerendel, "so we are not 100 percent neutral."	0		nicht-V
1131	0.466	Grade mal zwei Torchancen in 90 Minuten, damit lassen sich nur selten Spiele positiv gestalten.	Just two scoring chances in 90 minutes. Not a good chance for a positive outcome.	There are only two scoring chances in 90 minutes, so it is rare for games to be positive.	0		lexical (nur selten)
1929	0.47	Der Soziologie Professor drängt seine Meinung nicht auf, betont, dass er von dem Durchschnitt spricht, nicht von einzelnen Schicksalen.	The sociology professor does not force his opinion onto the audience, emphasizing that he speaks of the average, not of individual destinies.	The sociology professor does not impose his opinion, stresses that he is talking about the average, not about individual fates.	0		nicht-V
1924	0.47	Entscheidend sei deshalb nicht, ob man sich politisch rechts oder links einordnet, sondern: "Bin ich für oder gegen eine offene Gesellschaft?", betont er.	Therefore, it is not of importance whether one is politically right or left, but: "Am I for or against an open society?" he emphasizes.	The decisive factor is therefore not whether one classifies oneself politically to the right or to the left, but: "Am I for or against an open society?," he stresses.	0	ref and system use different forms	nicht-V
1928	0.47	El-Mafaalani steht vor, nicht auf der Bühne, ein Sinnbild für die Diskussion: Sie ist auf Augenhöhe.	El-Mafaalani stands in front of the stage, not on it, symbolizing the discussion: It is a discussion at eye level.	El-Mafaalani is standing in front, not on stage, a symbol of the discussion: she is on an equal footing.	0		nicht-PP
235	0.479	Das haben wir in anderen Stadtteilen noch nicht erlebt.	We have not seen something like this in other districts.	We haven't seen that in other parts of the city.	0		nicht-V
1582	0.493	Eine eingetragene Lebenspartnerschaft sei für sie nicht infrage gekommen, hatte Kahrs zuvor der "Bild"-Zeitung gesagt.	Kahrs previously told the ‘Bild’ newspaper that a registered civil partnership was not for them.	A registered civil partnership was out of the question for her, Kahrs had previously told the Bild newspaper.	0		nicht-V
1435	0.494	Aber dann würden da draußen nicht 10.000 Menschen in diese prall gefüllte Arena drängen, sondern wir hätten nur 200 Leute draußen stehen.	But 10,000 people outside would not be surging into this packed arena, we would only have 200 people standing outside.	But then there wouldn't be 10,000 people out there cramming into this packed arena, we'd only have 200 people standing outside.	0		nicht-NP
448	0.507	Warum es nie mit den Männern geklappt habe?	Why did it never work out with men?	Why did it never work out with the men?	0		nie
250	0.512	Wie alle traten auch die Kinder zum Finale noch einmal auf - und klangen sogar ohne elektronische Unterstützung "richtig gut", wie Franke sagte.	Like everyone else, the children also performed again for the finals - and even without electronic support, they sounded "really good," Franke said.	Like everyone else, the children performed again for the finale - and even without electronic support, they sounded "really good," as Franke said.	0		ohne
1527	0.517	An einem Kongress der Tafeln am Freitag in Berlin nahm der Essener nicht teil.	The man from Essen did not participate at a congress of the Tafel in Berlin on Friday.	The Essen man did not take part in a congress of the boards on Friday in Berlin.	0		nicht-V
1526	0.517	Es sei Aufgabe des Staates dafür zu sorgen, dass Menschen nicht verhungerten.	It would be the government’s obligation to ensure that people did not starve to death.	It was the task of the state to ensure that people did not starve to death.	0		nicht-V
1826	0.522	Eine Prognose zur Ausfallzeit gab der VfB Stuttgart nicht ab.	A downtime forecast was not given by VfB Stuttgart.	VfB Stuttgart did not give a forecast for the downtime.	0	ref and system use different forms (active vs. passive)	nicht-V
1684	0.525	Donnerstag hieß es dann, ein Übergreifen des Brands auf angrenzende Gemeinden drohe nicht mehr.	On thursday, it was reported that there is no longer a threat of the fire spreading to adjacent communities.	Thursday, it said the fire was no longer threatening to spread to neighboring communities.	0	ref and system use different forms  	nicht mehr
1607	0.527	Doch die sechs noch verbleibenden Starter konnten seine Fabelzeit von 89,69 Sekunden nicht toppen.	Yet the six remaining starters could not top his best time of 89.69 seconds.	But the six remaining starters could not top his fabulous time of 89.69 seconds.	0		nicht-V
378	0.541	Keine Spur von Scheu oder Fracksausen, die Unabhängigen machen ihr Ding.	No trace of shyness or getting the heebie-jeebies. The independents are doing their thing.	No hint of shyness or tailgating, the independents are doing their thing.	0		kein
293	0.542	Nirgendwo im Frankenwald wurde ein Ort so durch die Eisenbahn geprägt.	Nowhere in the Franconian forest has a place been characterized by the railway so much.	Nowhere in the Franconian Forest has a place been so shaped by the railway.	0		nirgendwo
1850	0.543	Eine Medaille war das Ziel, ich war in Topform, aber es wollte einfach nicht sein.	My goal was to win a medal. I was in peak form, but it just wasn’t to be.	A medal was the goal, I was in top form, but it just wasn't to be.	0		nicht-V
451	0.548	Leider ist diese Vision nicht alltagstauglich.	Unfortunately, this vision is not compatible with daily life.	Unfortunately, this vision is not suitable for everyday use.	0		nicht-ADJ
474	0.552	Und George Clooney, der seit Jahren für besagte Marke wirbt, ist an dem Abend auch nicht hier.	And George Clooney, who has been advertising for the brand mentioned for years, is also not there on the evening.	And George Clooney, who has been promoting the brand for years, is not here for the evening either.	0		nicht-ADV
184	0.554	Dem Münchner bekam der Ausflug in den hohen Norden aber gar nicht gut.	The trip didn’t do the actor any good, though.	But the trip to the far north did not go well for the Munich native.	0		nicht-ADJ
1513	0.557	"Besser können es Köche auch nicht", lobte eine Besucherin beeindruckt, während Hokkaido-Kürbissuppe serviert wurde oder sich die Gäste an Quiche, Leberkäse oder Kuchen bedienen durften.	Professional chefs could not do any better either, an impressed visitor said, while Hokkaido pumpkin soup was served and the guests enjoyed quiche, meatloaf or cake.	"Chefs can't do better either," praised one impressed visitor, while Hokkaido pumpkin soup was served or guests were allowed to help themselves to quiche, liver cheese or cake.	0		nicht-V
11	0.558	Berlin DFB-Präsident Reinhard Grindel sieht derzeit keine Grundlage für eine Rückkehr von Mesut Özil in die Nationalmannschaft.	Berlin - The president of DFB Reinhard Grindel sees no basis for the returning of Mesut Özil to the national team.	Berlin DFB president Reinhard Grindel currently sees no basis for Mesut Özil's return to the national team.	0		kein
1156	0.56	Wir wussten das zwar, aber so einen Spieler kann man halt nicht komplett rausnehmen.	We knew it, but you just can't completely take out a player like that.	We knew that, but you can't take a player like that out completely.	0		nicht-V
1653	0.564	Ehrlich gesagt konnte ich es als ihr Präsident nicht verdauen, dass unsere zwei jungen Männer, die bis in die deutsche Nationalmannschaft aufgestiegen sind, ausgegrenzt wurden.	Frankly speaking, as their president, I could not accept the fact that our two young men, who had been risen to the German national team, were excluded.	To be honest, as their president, I could not digest the fact that our two young men, who have risen to the top of the German national team, were marginalised.	0		nicht-V
1963	0.571	"Das war sehr emotional, das war großer Sport", meinte später Tedesco über die Reaktion seinen Vize-Kapitäns, der trotz seines erneuten Reservisten-Daseins keinerlei Groll hegte.	That was very emotional, he is such a great sport, Tedesco said later about the reaction of his vice-captain, who holds no grudge despite his seat on the bench.	"It was very emotional, it was great sport," Tedesco later said of the reaction of his vice-captain, who held no grudges despite being a reserve again.	0		kein
1477	0.581	Er habe daher bei Erdogan "deutlich gemacht, dass wenn die Beziehungen sich normalisieren sollen in der Zukunft, wenn die wirtschaftlichen Beziehungen vertieft werden sollen, dass dafür Rechtsstaatlichkeit eine ganz wichtige Voraussetzung ist".	He therefore made it clear to Erdogan that "if in the future relations are going to become normal and if economic relations are going to deepen, then the rule of law is a very important condition."	He had therefore "made it clear to Erdogan that if relations are to normalise in the future, if economic relations are to be deepened, the rule of law is a very important prerequisite for this."	0	no negation, why is this here?	n/a
210	0.584	Nicht nur der Müll treibt Radfahrer und Anwohner um - die Sitzgruppe ist an Wochenenden regelmäßiger Treffpunkt zum Feiern.	Not only the rubbish is a nuisance for cyclists and residents - on weekends the seating group is a regular meeting place for partying.	It's not just the rubbish that drives cyclists and residents around - the seating area is a regular meeting place for partying at weekends.	0		nicht nur
