a_line_number	b_z_score	c_source_sent	d_reference_sent	e_system_output	f_neg_error	g_notes	h_source_cue
1130	-0.341	Der Gegner war einfach griffiger, wir haben ihn so gut wie nie vor Probleme gestellt". Entsprechend dünn liest sich die Liste der Hoetmarer Einschussmöglichkeiten.	The opponent was just easier to grip, we have almost never faced problems." Accordingly thin reads the list of Hoetmarer bullet options.	The opponent was simply more handy, we hardly ever presented him with any problems. "Accordingly, the list of Hoetmar shooting possibilities reads thin.	1	contradiction; here getting the verb wrong totally changes the meaning // ALSO THE REFERENCE TRANSLATION IS WRONG	nie
1011	-0.341	Die Geselligkeit ist es, die die Besucher dann lange bis in die Abendstunden, auch ohne Bühnenprogramm das es beim Herbstfest nicht gibt, verweilen ließ.	It is this friendly atmosphere that makes visitors stay late into the evening hours even in the absence of stage events, which are not part of the fall festival.	It is the conviviality that allowed the visitors to linger long into the evening hours, even without a stage program that does not exist at the autumn festival.	0	ref and system use different forms ("absence of x" vs. "without x")	ohne, nicht-V
528	-0.33	In dem Vergleich, der noch von einem Gericht bestätigt werden muss, räumten weder Musk noch Tesla Fehlverhalten ein.	In the settlement, which still has to be confirmed by a court, Musk nor Tesla admitted wrongdoing.	In the settlement, which has yet to be confirmed by a court, neither Musk nor Tesla admitted wrongdoing.	0		weder ... noch
1376	-0.324	Von Lampenfieber dabei keine Spur.	There is no hint of stage fright in the process.	There was no sign of stage fright.	0		kein
259	-0.324	So ist gewährleistet, dass die Gegenseite auch aus Versehen nichts lesen kann.	This ensures the other side cannot read anything unintentionally.	This ensures that the other side cannot read anything, even by mistake.	0		nicht-V
442	-0.234	Sie habe stets das Gefühl gehabt, "nicht gut genug für ihn zu sein.	She always had the feeling of ‘not being enough for him.	She had always felt she was "not good enough for him.	0		nicht-ADJ
1096	-0.188	Für den Trainer war der teuer eingekaufte Star auch ohne eigenes Tor der entscheidende Mann in der wichtigen Partie gegen den Verfolger.	For the coach, the expensively purchased star without scoring himself was the decisive man of the match in the important game against the pursuers.	For the coach, even without an own goal, the expensively purchased star was the decisive man in the important match against the chasing pack.	1	error in interpretation/translation of the object noun causes contradiction	ohne
268	-0.183	Erraten werden sollen in "Decrypto" nicht die Begriffe hinter der Geheimfolie, sondern ihre Verschlüsselungscodes.	In "Decrypto," it is not the words behind the secret film that should be guessed, but their encryption codes.	What is to be guessed in "Decrypto" is not the terms behind the secret foil, but their encryption codes.	0		nicht-NP
1816	-0.173	In anderen Regionen, die nicht vom Tsunami getroffen wurden, gab es die Fehlinformation, dass ein Tsunami auf die Region trifft und sie sind auf die umliegenden Berge gerannt.	In other regions not affected by the tsunami, there was false information about a tsunami hitting the region and they ran to the surrounding hills.	In other regions that were not hit by the tsunami, there was the misinformation that a tsunami was hitting the region and they ran to the surrounding mountains.	0		nicht-V
466	-0.153	Und der Hammer ist: All die Verkaufsregale voll exklusiver Produkte sind für den Anlass nicht ausgeräumt worden.	And the highlight is: that the shop shelves have not been cleared of the exclusive products for the event.	And the hammer is: All the sales shelves full of exclusive products have not been cleared out for the occasion.	0		nicht-V
1122	-0.122	Das Pseudonym ist allerdings keine Neuigkeit.	However, the pseudonym is not news.	The pseudonym is not news, however.	0		kein
17	-0.12	Der DFB-Chef wiederholte seine Kritik an Özil, dass dieser nicht für ein Gespräch mit Bundestrainer Joachim Löw und Teammanager Oliver Bierhoff bereit sei.	The DFB head repeated his criticism of Özil and that he is not ready for a discussion with national coach and team manager Oliver Bierhoff.	The DFB chief repeated his criticism of Özil for not being ready for a conversation with national coach Joachim Löw and team manager Oliver Bierhoff.	0		nicht-ADJ
478	-0.117	Er wird nicht angequatscht, nicht begafft, man schielt höchstens verstohlen.	He is not talked into, not gaped at, at the most he receives stealthy glances.	He is not gossiped at, he is not gawked at, at most he is stealthily squinting.	0		nicht-V
914	-0.088	Um aber konstruktiv zu sein, darf Streit nicht wieder aus parteitaktischen Gründen zur Frage von Sein oder Nichtsein aufgebauscht werden.	But to be constructive, dispute should not be exaggerated again for party tactical reasons regarding the question of being or not-being.	In order to be constructive, however, disputes must not again be exaggerated for party-tactical reasons into the question of being or not being.	0		nicht-V, nicht-pref
1327	-0.065	Statt am heutigen Samstag werde die Ministerin erst am Montag vor der Vollversammlung der Vereinten Nationen sprechen, teilte ihr Sprecher Adam Austen mit.	Instead of today, Saturday, the minister will not speak before the United Nations general assembly until Monday, shared her spokesperson Adam Austen.	Instead of this Saturday, the minister will not address the United Nations General Assembly until Monday, her spokesman Adam Austen said.	0		lexical (erst am Montag)
926	-0.045	Sie gehe davon aus, "dass die Ministerin nur ihre Begeisterung über den Einsatz ihres Teams zum Ausdruck bringen und keinesfalls Verstöße gegen geltendes Dienstrecht vor laufenden Kameras verkünden wollte".	She assumes that ‘the minister is only trying to express her enthusiasm about the engagement of her team, and did not intend to convey any possible violations of the labor law with the cameras rolling’.	She said she believed "the minister only wanted to express her enthusiasm for the deployment of her team and in no way to announce breaches of applicable service law in front of running cameras."	0		keinesfalls
1451	-0.043	Sie gaben uns nichts zu essen, wir mussten aus der Latrine trinken.	They didn't give us anything to eat. We had to drink out of the latrine.	They gave us nothing to eat, we had to drink from the latrine.	0		nichts
1879	-0.036	Das war im Heimspiel gegen Mainz 05 nicht anders.	The home game against Mainz 05 was no different.	It was no different in the home game against Mainz 05.	0		nicht-ADJ
133	-0.028	Wir werden nicht zulassen, dass Sympathisanten der PKK oder Gülen-Bewegung unsere Bürger erschüttern und der deutsch-türkischen Freundschaft schaden", sagte er.	We will not allow sympathizers of the PKK or Gülen movement to unsettle our citizens and damage the German/Turkish friendship’, he said.	We will not allow sympathizers of the PKK or Gülen movement to upset our citizens and harm German-Turkish friendship, "he said.	0		nicht-V
1964	-0.012	Wahrscheinlích weiß Naldo, der in der vergangenen Saison als bester Schalker gefeiert wurde, dass er bei seinem Trainer tatsächlich nicht aufs Abstellgleis geraten ist - sondern aus gutem Gründen eine Pause erhält.	Naldo, who was awarded best Schalke player last season, probably knows that he is actually not going to be stuck on the bench - he does have a good reason for this break.	Probably Naldo, who was celebrated as the best Schalke player last season, knows that he is actually not on the sidelines with his coach - but gets a break for good reason.	0		nicht-PP
696	-0.009	Ferrari machte im ersten Halbjahr mit jedem verkauften Auto 69.000 Euro Betriebsgewinn - Jaguar Land Rover dagegen kommt nur auf rund 800 Euro, Tesla und Bentley legen sogar bei jedem Auto kräftig drauf.	Within the first half of year Ferrari got 69,000 euros of business profit for each sold car, Jaguar Land Rover only comes to around 800 euros, whereas Tesla and Bentley do not put emphasis on their income from each car.	Ferrari made an operating profit of 69,000 euros for each car sold in the first half of the year - Jaguar Land Rover, on the other hand, only makes around 800 euros, while Tesla and Bentley even make a big profit on each car.	1	not sure that either quite gets it right // according to my human source, Tesla and Bentley are losing heftily on every car - "drauflegen" generally indicates running a loss, subsidizing something	no negation in source - sogar (in contrast to the others)
389	-0.009	Das bricht uns nicht das Genick.	That was not our undoing.	It doesn't break our neck.	0	same meaning, but figurative expression	nicht-V
882	-0.004	"Das kann ich fast 30 Jahre nach der Deutschen Einheit niemandem erklären", sagte Schwesig.	This is inexplicable, nearly 30 years after the German Unification, said Schwesig.	"Almost 30 years after German unification, I can't explain that to anyone," Schwesig said.	0		neimand
1625	0	Erstmals seit mehr als einem Jahr auswärts kein eigenes Tor geschossen, wie zur gleichen Zeit der Vorsaison zwei Pflichtspiele in Serie ohne Sieg, die Tabellenführung in der Fußball-Bundesliga vorerst an Borussia Dortmund verloren.	For the first time within more than a year of playing away there were scored no goals, as at the same time two mandatory preseason games in series without a victory, the league leaders in the Bundesliga lost to Borussia Dortmund.	For the first time in more than a year no own goal was scored away from home, as at the same time of the pre-season two obligatory games in a row without a win, lost the league lead in the Bundesliga to Borussia Dortmund for the time being.	0		kein, ohne
1890	0.001	"Uns ist allen ein riesiger Stein vom Herzen gefallen", sagte Schöpf, der daran mit seinem Kopfballtreffer keinen unwesentlichen Anteil hatte: "Dabei bin ich eigentlich der schlechteste Kopfballspieler in der Mannschafft".	We all felt a huge weight lifted off our shoulders, said Schöpf, whose scoring header played no insignificant part: "And I am actually the worst header on the team."	"We all fell a huge stone from our hearts," said Schöpf, who had no small part in this with his header goal: "I am actually the worst header player in the team."	0		kein, un-
394	0.004	Mit Regionalliga-Volleyball ist das nicht annähernd vergleichbar". In die vierte Liga wollen sie ihren Blick ohnehin nicht mehr nach unten richten.	It’s not even close with regional league volleyball.” They don't even want to look down towards the fourth league.	This is not nearly comparable to regional league volleyball. "In any case, they no longer want to look down into the fourth division.	0		nicht-ADJ, nicht mehr
283	0.008	Nachdem er deutlich alkoholisiert dem erteilten Platzverweis durch die Polizei nicht nachkam, musste er die Nacht bei der Polizeiinspektion Kulmbach in der Haftzelle verbringen.	After clearly under the influence of alcohol he did not comply with the police order to vacate the premises, he had to spend the night in the detention cell in the police station of Kulmbach.	After he was clearly drunk and did not comply with the court order issued by the police, he had to spend the night in the detention cell at the Kulmbach police inspectorate.	0		nicht-V
597	0.024	Wir haben den Test gewagt: Wie reagieren Frauen, man gleich in der ersten Nachricht nicht lange um den heißen Brei herumredet?	We made the test: How do women react, if you do not beat around the bush in the first message?	We took the test: How do women react if you don't spend a lot of time talking about it in the first message?	1	figurative expression, not a contradiction, but meaning doesn't match	nicht-ADV (fig.)
1626	0.026	Die Gesamtsituation stellt sich zwar längst nicht so dramatisch wie zur Endphase des gescheiterten Carlo Ancelotti Ende September 2017 dar, dennoch muss der Rekordmeister gewarnt sein.	The overall situation is not nearly as dramatic as the final phase of the failed Carlo Ancelotti at the end of September 2017, but the champions shall be aware.	Although the overall situation is nowhere near as dramatic as it was at the end of the failed Carlo Ancelotti era at the end of September 2017, the record signing still has to be warned.	0		nicht-ADJ
959	0.035	Auch beim FC Gütersloh reichte es nur zu einem 0:0-Unentschieden.	FC Gütersloh only didn’t get further than a 0-0 draw.	Even at FC Gütersloh it was only enough for a 0-0 draw.	1	slight error	lexical (reicht es nur)
1631	0.053	So unternahm Kovac vor dem zweiten Königsklassen-Auftritt dieser Saison nach dem 2:0 bei Benfica Lissabon auch keine außergewöhnlichen Maßnahmen.	So before the second premier class appearance in this season after the 2-0 over Benfica Lisbon, Kovac undertook no extraordinary measures.	Kovac did not take any extraordinary measures ahead of his second Premier League appearance of the season after the 2-0 defeat at Benfica Lisbon.	0	ref and system use different forms	kein
1438	0.061	Erstmals fand das Oktoberfest nämlich nicht bloß im Festzelt am Feuerwehrturm statt, sondern wurde vom Gewerbeverband am Sonntag auf die City ausgedehnt.	For the first time, the Oktoberfest was not just held in the marquee at the Feuerwehr tower, but on Sunday was extended into the city by the trade association.	For the first time, the Oktoberfest did not just take place in the marquee at the fire brigade tower, but was extended to the city by the trade association on Sunday.	0		nicht-PP
568	0.061	Umfragen: 46 Prozent wollen Merkel nicht bis 2021 als Kanzlerin	Survey: 46 percent do not want Merkel as Chancellor until 2021	Polls: 46 percent don't want Merkel as chancellor until 2021	0		nicht-V
1146	0.061	"Wir haben gar keinen Zugriff auf die bekommen". Mit die meinte er mutmaßlich die Flügelzange mit Colby McGill und Janis Kröger, wohl aber auch alle anderen Grün-Weißen, die mit kollektivem Offensivdrang auffielen.	We did not get any access to them. With ‘them’, he allegedly meant the wing players Colby McGill and Janis Kröger, but probably also all the other green and whites, who made themselves noticeable with their collective offensive urge.	"We didn't get access to them at all." By which he presumably meant the wing pliers with Colby McGill and Janis Kroeger, but probably also all the other green-whites who caught the eye with their collective offensive drive.	0		kein
1411	0.091	Die Absturzstelle liegt nur unweit eines Festzeltes auf dem Flughafengelände entfernt.	The crash site is not far from a marquee within airport premises.	The crash site is just a short distance from a marquee on the airport grounds.	0	ref and system use different forms	un-
1628	0.106	"Die, die den FC Bayern kennen, wissen, dass wir uns das nicht gefallen lassen und wir alles tun werden, damit wir wieder erfolgreich sind", betonte Kovac.	Those who know Bayern are aware that we will not put up with that and that we will do everything to become successful again, Kovac said.	"Those who know FC Bayern know that we will not put up with this and we will do everything we can to be successful again," stressed Kovac.	0		nicht-V
359	0.109	Die Gäste saßen nicht wie sonst im "Haus der Begegnung" in Sitzreihen, sondern gemütlich an Tischen.	Guests did not sit in rows as usual in the “House of Encounter,” but rather sat comfortably around tables.	The guests did not sit in rows of seats as usual in the "House of Encounter," but sat comfortably at tables.	0		nicht-V
1961	0.111	Gelsenkirchen - Nachdem Ronaldo Aparecido Rodrigues zum dritten Mal in Folge nicht in der Schalker Startelf, sondern auf der Auswechselbank gesessen hatte, wäre das Verständnis bei vielen Menschen groß gewesen, wenn sich der fast zwei Meter große Brasilianer mal so richtig den Frust von der Seele geredet hätte.	Gelsenkirchen - After Ronaldo Aparecido Rodrigues has not been in the Schalke starting line-up for the third time in a row, many people would have understood it if the almost two-meters-tall Brazilian player had got his frustration off his chest.	Gelsenkirchen - After Ronaldo Aparecido Rodrigues had not been in the Schalke starting line-up for the third time in a row, but had sat on the substitutes "bench, the understanding of many people would have been great if the almost two-metre tall Brazilian had let his frustration get the better of him.	0		nicht-PP
646	0.116	Jannis Schneider ließ sich das Geschenk nicht entgehen (79.).	Jannis Schneider was not ready to miss this opportunity (minute 79).	Jannis Schneider did not miss the gift (79.).	0	ref and system use different forms, figurative	nicht-V
1804	0.125	Viele sind auf umliegende Hügel gerannt, auf denen sie immer noch aus Angst vor einem weiteren Tsunami und Erdbeben ausharren und wo sie keinen Zugang zu Wasser und Essen haben.	Many ran to the surrounding hills, where they held out through fear of another tsunami and earthquake, and where there is no access to water and food.	Many have run to surrounding hills, where they are still holding out for fear of another tsunami and earthquake, and where they have no access to water or food.	0		kein
978	0.131	Erst in der 91. Minute hatte Cihan Yilmaz die letzte Chance, aber auch die brachte nichts ein.	Only in the 91st minute did Cihan Yilmaz have the last chance, but that did not get them anywhere.	It wasn't until the 91st minute that Cihan Yilmaz had his last chance, but even that came to nothing.	0	ref and system use different forms	nichts
1621	0.132	Die erste kleine Leistungsdelle unter dem neuen Coach Niko Kovac soll sich für die Münchner keinesfalls zum größeren herbstlichen Tief steigern.	Under no circumstances should the first small drop in power with the new coach Niko Kovaca should increase for Munich to the autumn minimum.	The first small dip in performance under new coach Niko Kovac should not be a major autumn low for the Munich-based side.	0	ref and system use different forms	keinesfalls
756	0.132	Der Diesel spielt dabei eigentlich keine große Rolle mehr.	The diesel does not really matter now.	The diesel doesn't really play a big role any more.	0	ref and system use different forms, figurative	kein
1812	0.162	Viele Leute suchen immer noch nach ihren Kindern, Nachbarn und anderen Menschen, von denen sie nicht wissen, ob sie leben und wo sie sich aufhalten, weil die Menschen während der Erdbeben nicht zu Hause, sondern zum Beispiel auf der Arbeit unterwegs waren.	Many people are still looking for their children, neighbors and other persons, not knowing if they are alive and where they are staying, because people were not at home during the earthquake and were on the way to work, for example.	Many people are still looking for their children, neighbours and other people who they do not know if they live or where they are, because people were not at home during the earthquakes, but at work, for example.	0		nicht-PP
601	0.166	So ist es der Urheberin dieser Annonce in einer uns unbekannten Aldi-Filiale durchaus zu wünschen, dass sie ihren Traummann, mit dem sie sich kurz über das "30 Prozent reduzierte Bio-Putenfleisch" unterhalten hat, auch finden wird.	So, we wish the creator of this ad in an unknown Aldi branch that she will also find the man of her dreams, with whom she had talked briefly about the "Organic turkey meat, 30 percent off".	So it is to be wished to the author of this advertisement in an Aldi store unknown to us that she will also find her dream man, with whom she talked briefly about the "30 percent reduced organic turkey meat."	0		un-
440	0.177	Keller habe stets versucht für Hans von Borsody "die einzig Richtige zu sein und er wollte meine Ängste, meine Schwächen nicht kennenlernen.	Keller always made effort for Hans von Borsody "and he did not want to discover my fears and my weaknesses.	Keller had always tried to be "the only right person for Hans von Borsody and he did not want to know my fears, my weaknesses.	0		nicht-V
1670	0.18	Darauf angesprochen, wollte der Mann keine Polizei vor Ort und ist anschließend davon gefahren.	When asked, the man did not want the police on the scene and then drove off.	Asked about it, the man did not want police on the scene and then drove away.	0		kein
367	0.184	"Es macht einfach Spaß, unter seiner Leitung zu singen", sagte Holstiege: "Er hat eine so leichte Art, es ist eine Meisterleistung, die er vollbringt". Übrigens präsentierten sich dieses Mal nicht nur Männer sängerisch.	It's just fun to sing under his direction, said Holstiege. "He has such an easy way, he accomplishes a masterpiece every time.". By the way, this time not only men were presented vocally.	"It's just fun to sing under his direction," Holstiege said: "He has such an easy manner, it's a feat he accomplishes." By the way, this time it wasn't just men who presented themselves as singers.	0	ref and system use different forms	nicht nur
349	0.184	Sie wollten sich partout nicht damit abfinden, dass es nach der Auflösung des Kirchenchors "Cäcilia" kein Sangesleben mehr im Stadtteil geben sollte.	In no case did they want to accept that after the dissolution of the church choir "Cäcilia" there would be no more singing life in the district.	They did not want to resign themselves to the fact that, after the dissolution of the church choir "Cecilia," there would no longer be a singing life in the district.	0	ref and system use different forms	nicht-V, kein
1821	0.194	Muskelverletzungen gegen Werder: VfB muss lange auf Aogo und Donis verzichten	Muscle injuries to Werder: VfB has to do without Aogo and Donis	Muscle injuries against Werder: VfB have to do without Aogo and Donis for a long time	0		lexical (verzichten)
1059	0.202	Einen zusätzlichen Personalabbau über die bereits bekannten Kürzungen in der Verwaltung hinaus soll es nicht geben.	There will be no further downsizing in addition to the reductions already known about.	There should be no additional staff cuts in addition to the cuts already known in the administration.	0		nicht-V
1719	0.208	Das neue Verfahren ändert nichts daran, dass Organe weiterhin nur mit ausdrücklicher Zustimmung entnommen werden dürfen, betont Swisstransplant.	Swisstransplant emphasizes that the new process will not change the way organs are only extracted with express consent.	The new procedure does not change the fact that organs may continue to be removed only with explicit consent, stresses Swisstransplant.	0		nicht-V
1707	0.208	Zuvor hatten sie ihre Lebenspartnerschaft seit 2001 eintragen lassen können, es gab aber keine Gleichstellung mit der Ehe, etwa beim Adoptionsrecht.	Before this they were able to register their civil partnership from 2001, but there was no equality in terms of marriage and the right to adopt.	Previously, they had been able to register their civil partnership since 2001, but there was no equality with marriage, such as the right to adopt.	0		kein
1699	0.208	Eine eingetragene Lebenspartnerschaft sei für sie nicht infrage gekommen, hatte Kahrs zuvor der "Bild"-Zeitung gesagt.	Kahrs previously told the “Bild” newspaper that a registered civil partnership was not for them.	A registered civil partnership was out of the question for her, Kahrs had previously told the Bild newspaper.	0	ref and system use different forms	nicht-V
1619	0.212	Das Prädikat unschlagbar ist dahin: Die Niederlage in Berlin will sich der FC Bayern "nicht gefallen lassen".	The title of unbeatable is gone: The defeat in Berlin will not allow the FC Bayern to give up.	The predicate of unbeatable is gone: the FC Bayern does not want to put up with the defeat in Berlin.	0	ref and system use different forms	nicht-V
977	0.212	Mehr als optische Überlegenheit dank eigener Initiative brachten die Ahlener nicht zustande.	The team from Ahlen did not achieve more than optical superiority thanks to their own initiative.	The Ahlens did not achieve more than visual superiority thanks to their own initiative.	0		nicht-V
1636	0.222	"Ich glaube nicht, dass das alles Pech ist, wir müssen es uns auch schon wieder erarbeiten, weil wir die Vielzahl an Chancen nicht machen und hinten die Fehler machen", betonte der 23-Jährige kurz vor der Abfahrt aus dem Olympiastadion.	I do not believe that this is all bad luck, we need to work it out again, because we do not go for most of the opportunities and make mistakes, said the 23-year-old shortly before leaving the Olympic stadium.	"I don't think it's all bad luck, we have to work it out again because we don't make the many chances and make the mistakes at the back," stressed the 23-year-old shortly before leaving the Olympic Stadium.	0		nicht-V
846	0.226	Diese ist bis heute nicht fertiggebaut, lediglich der Altarraum steht, das fehlende Langhaus wird durch die Bäume angedeutet.	The construction is not finished yet, only the sanctuary is, the missing nave is indicated by the trees.	This is not finished until today, only the sanctuary is standing, the missing nave is indicated by the trees.	1	"bis heute" causes the problems, but negation is involved	nicht-ADJ
899	0.226	Kaum ein Interview, kaum eine Rede, in der die Kanzlerin und ihre Minister aus CDU, SPD und auch aus der CSU zuletzt nicht die "Rückkehr zur Sacharbeit" mantraartig beschworen haben.	Hardly an interview, hardly a speech in which the Chancellor and her ministers from the CDU, SPD and also lastly from the CSU did not invoke the mantra "return to work".	Hardly an interview, hardly a speech in which the Chancellor and her ministers from the CDU, SPD and also from the CSU did not conjure up the mantra of a "return to business as usual."	0		nicht-V
